{
  "_id": 1,
  "name": {
    "first": "John",
    "last": "Backus"
  },
  "birthYear": 1924,
  "deathYear": 2007,
  "contribs": [
    "Fortran",
    "ALGOL",
    "Backus-Naur Form",
    "FP"
  ],
  "awards": [
    {
      "award": "W.W. McDowell Award",
      "year": 1967,
      "by": "IEEE Computer Society"
    },
    {
      "award": "National Medal of Science",
      "year": 1975,
      "by": "National Science Foundation"
    },
    {
      "award": "Turing Award",
      "year": 1977,
      "by": "ACM"
    },
    {
      "award": "Draper Prize",
      "year": 1993,
      "by": "National Academy of Engineering"
    }
  ]
}
